Earings,Shining Diva Fashion Latest Stylish Pink Flower Pearl Earrings for Women and Girls (14974er),239,"Latest Design Party Wear Earrings for Women - Shining Diva Fashion Jewellery presents these Crystal Flower Stylish Fancy Party Wear Earrings for Women and Girls. A designer pair of new design Earings for Women and Girls that will make you feel like a Diva. The color complements all outfits & may be worn as a statement piece to any occasion. Shining Diva has huge collection of latest modern Fashion and Traditional jewellery accessories. Shining Diva is pioneer of Imitation jewellery for women and designer crystal, traditional jhumka / jhumki , ear studs, fancy tops, traditional earrings for women , fancy ear rings and american diamond hangings Earrings for women and girls. Shining Diva Fashion and Traditional Jewellery give true value for your money. Buy Shining Diva trendy, artificial and stylish jewellery for women from Amazon in offer. These are also ideal for birthday gifts for girls, Wife, wedding gifts and anniversary gifts. Best Valentine Gifts for Girlfriend.",3.6,Xcelnt  d product s worth buying stylish with graceful look.Appear same as given and fits with every outfit.,https://m.media-amazon.com/images/I/31KjeLAnxSL._SY300_SX300_.jpg
Earings,Yellow Chimes Earrings for Women & Girls | Fashion Crystal Studded Dangler Earring | Western Long Dangler Earrings | Accessories Jewellery | Birthday & Anniversary Gift,385,"Yellow Chimes brings to you the latest designer earrings for women stylish designs and you can choose from assorted collections like oxidized earrings for girls and women, crystal earrings, silver earrings, gold earrings, pearl earrings for women with high quality finishing to drop an elegance on your persona with intricate designs. Yellow Chimes has always been one of the best seller brands on Online Marketplaces as we have the most demanding and trending designs and collections in price worthy Quality. Yellow Chimes also has its unique party wear collections with latest and trendy looks which are suitable for parties, earrings combo for daily wear earrings for date nights. These collections are also suitable for valentine gifts, gifts for women, birthday gift for girls, anniversary gift for wife, gifts for girlfriend, Mother’s Day gifts. You name it in the collection of jewellery, Yellow Chimes has something for everyone.",4.3,"Just amazing product... light weight, sparkling, inexpensive, must have..👍👍",https://m.media-amazon.com/images/I/21i+t+J3cpL._SY300_SX300_.jpg
Earings,Estele Women's 24K Rose Gold Plated American Diamond Brass Metal Mesh Drop Earring,719,"Estele is not simply a brand or a jewellery line it is the identity of the modern woman, a mirror of her soul and an outlet for her personality. Estele offers an extensive range of designs, embodying inspiration and confidence for the elegant and stylish modern Indian woman.",4.4,Very nice quality and finishing. Light weight and gives a classy look,https://m.media-amazon.com/images/I/51Gj1KilwKL._SY300_SX300_.jpg
Earings,Shining Diva Fashion Latest Crystal Pearl Silver Plated Earrings for Women,298,"Latest Design Silver Plated Pearl Earrings for Women. Shining Diva Fashion Jewellery presents these Stylish Fancy Party Wear Earrings for Women and Girls. A designer pair of latest new design stud Earings for Womens and Girls that will make you feel like a Diva. The color complements all outfits & may be worn as a statement piece to any occasion. Shining Diva has huge collection of latest modern Fashion and Traditional jewellery accessories. Shining Diva is pioneer of Imitation jewellery for women and designer crystal, traditional jhumka / jhumki, ear studs, fancy tops, traditional earrings for women , fancy ear rings and american diamond hangings Earrings for women and girls. Shining Diva Fashion and Traditional Jewellery give true value for your money. Buy Shining Diva trendy, artificial and stylish jewellery for women from Amazon. These are also ideal for special birthday gifts for girls, Wife, valentine gifts for girlfriend, wedding gifts and anniversary gifts.",4,Perfect size I needed. It's too cute and very good finish. It's not heavy on ears,https://m.media-amazon.com/images/I/41VTeY0d2kL._SY300_SX300_.jpg
Earings,YouBella earrings for women Jewellery Crystal Stud Earrings Combo Tops for Girls and Women,298,"Stylish Party Wear Earrings - YouBella Fashion Jewellery presents these stylish Earrings which are suitable for all occasions office wear, wedding and party wear. The color complements all outfits & may be worn as a statement piece to any occasion. The designer artificial jewellery at YouBella is available in various designs and patterns like floral design, heart shape design, dancing peacock, crystal design and many more. The imitation designer jewellery that will go with your outfit and style up your fashion statement with variable designs and patterns to give you charming and elegant look is available at YouBella. YouBella has huge collection of designer imitation jewellery like american diamond jewellery collection, gold plated jewellery collection, temple jewellery collection, valentine collection, jewellery combos and many more.",4.1,It looks so good on me....worth every penny,https://m.media-amazon.com/images/I/41JTJDVX6CL._SY300_SX300_.jpg
Earings,YouBella Jewellery Earings Gold Plated Floral Earrings for Girls and Women,219,"Stylish Party Wear Earrings - YouBella Fashion Jewellery presents these stylish Earrings which are suitable for all occasions office wear, wedding and party wear. The color complements all outfits & may be worn as a statement piece to any occasion. The designer artificial jewellery at YouBella is available in various designs and patterns like floral design, heart shape design, dancing peacock, crystal design and many more. The imitation designer jewellery that will go with your outfit and style up your fashion statement with variable designs and patterns to give you charming and elegant look is available at YouBella. YouBella has huge collection of designer imitation jewellery like american diamond jewellery collection, gold plated jewellery collection, temple jewellery collection, valentine collection, jewellery combos and many more.",4.1,The white shade I bought is just lovely and so pretty 😍,https://m.media-amazon.com/images/I/41H-skHewfL._SY300_SX300_.jpg
Earings,YouBella Fashion Jewellery Earings Drop and Dangler Ear rings Crystal Earrings for Girls and Women,298,"Stylish Party Wear Earrings - YouBella Fashion Jewellery presents these stylish Earrings which are suitable for all occasions office wear, wedding and party wear. The color complements all outfits & may be worn as a statement piece to any occasion. The designer artificial jewellery at YouBella is available in various designs and patterns like floral design, heart shape design, dancing peacock, crystal design and many more. The imitation designer jewellery that will go with your outfit and style up your fashion statement with variable designs and patterns to give you charming and elegant look is available at YouBella. YouBella has huge collection of designer imitation jewellery like american diamond jewellery collection, gold plated jewellery collection, temple jewellery collection, valentine collection, jewellery combos and many more.",4.1,The pair of earrings is really elegant and beautiful. Worth the price.,https://m.media-amazon.com/images/I/51geXXbR-WL._SY300_SX300_.jpg
Earings,YouBella Jewellery for women earings Gold Plated Crystal Stud Tops Earrings for Girls and Women,238,"Stylish Party Wear Earrings - YouBella Fashion Jewellery presents these stylish Earrings which are suitable for all occasions office wear, wedding and party wear. The color complements all outfits & may be worn as a statement piece to any occasion. The designer artificial jewellery at YouBella is available in various designs and patterns like floral design, heart shape design, dancing peacock, crystal design and many more. The imitation designer jewellery that will go with your outfit and style up your fashion statement with variable designs and patterns to give you charming and elegant look is available at YouBella. YouBella has huge collection of designer imitation jewellery like american diamond jewellery collection, gold plated jewellery collection, temple jewellery collection, valentine collection, jewellery combos and many more.",3.7,Color of the stones is bright and looks good,https://m.media-amazon.com/images/I/51MNpMJXdWL._SY300_SX300_.jpg
Earings,Shining Diva Fashion Latest 18k Rose Gold Stylish Bracelet Earrings Combo Jewellery For Women and Girls,239,"Stylish Bracelet from the house of Shining Diva. This latest new design bangle bracelet can be used by ladies as daily wear or party wear. This modern stylish bracelet is perfect to revamp your fashion jewellery collection. These are also special for gifts for girls for birthday, women, wife, best friend, valentine gift for girlfriend love, wedding gifts and anniversary gifts. Shining Diva is a well known brand across fashion jewellery sector. Shining Diva products are stylish and funky and are available at most affordable prices. This latest design rose gold plated jewellery is studded with crystals stones. Shining Diva has huge collection of latest bangles for women traditional, bangles for wedding, party wear earrings, charm bracelets, western wear modern choker necklace for women, traditional jewellery set, pendant set and other accessories for women which includes ear cuffs, fashion party wear necklace and traditional earrings. Shining Diva is pioneer of Imitation jewellery and designer crystal pendent for girls. Shining Diva Fashion and Traditional jewelry give true value for your money. Buy Shining Diva trendy, artificial and semi precious jewellery from Amazon in low price offer.",4.1,Too beautiful and elegant.... I got it for myself and gifted it to my niece... Must buy... Good quality product..,https://m.media-amazon.com/images/I/51jwpRuXsQL._SY300_SX300_.jpg
Earings,YouBella Jewellery Earrings for women Crystal Tassel Handmade Earrings for Girls and Women,345,"Stylish Party Wear Earrings - YouBella Fashion Jewellery presents these stylish Earrings which are suitable for all occasions office wear, wedding and party wear. The color complements all outfits & may be worn as a statement piece to any occasion. The designer artificial jewellery at YouBella is available in various designs and patterns like floral design, heart shape design, dancing peacock, crystal design and many more. The imitation designer jewellery that will go with your outfit and style up your fashion statement with variable designs and patterns to give you charming and elegant look is available at YouBella. YouBella has huge collection of designer imitation jewellery like american diamond jewellery collection, gold plated jewellery collection, temple jewellery collection, valentine collection, jewellery combos and many more.",4.2,I like the colourand even the quality of the chains are quite good. It is light weight and gives a decent look,https://m.media-amazon.com/images/I/41DQ45L-Z7L._SY300_SX300_.jpg
Earings,YouBella Jewellery Sets for Women Enamel Necklace Pendant Jewellery set with Earrings For Girls/Women,298,"stylish party wear jewellery necklace - youbella fashion jewellery presents these stylish jewellery Necklaces suitable for all occasions office wear, wedding and party wear. the color complements all outfits & may be worn as a traditional/statement piece to any occasion. the designer artificial jewellery at youbella is available in various designs and patterns like floral design, heart shape design, dancing peacock, crystal design and many more. youbella has huge collection of designer imitation jewellery like american diamond jewellery collection, gold plated jewellery collection, temple jewellery collection, valentine collection, jewellery combos and many more.",4,Best product Paisa vasool,https://m.media-amazon.com/images/I/41aP0oVikVL._SY300_SX300_.jpg
Earings,Yellow Chimes Earrings for Women & Girls | Traditional Multicolor Jhumka | German Silver Earring Set | Dome Shape Jhumki Combo | Accessories Jewellery | Birthday & Anniversary Gift,330,"Yellow Chimes brings to you the latest designer earrings for women stylish designs and you can choose from assorted collections like oxidized earrings for girls and women, crystal earrings, silver earrings, gold earrings, pearl earrings for women with high quality finishing to drop an elegance on your persona with intricate designs. Yellow Chimes has always been one of the best seller brands on Online Marketplaces as we have the most demanding and trending designs and collections in price worthy Quality. Yellow Chimes also has its unique party wear collections with latest and trendy looks which are suitable for parties, earrings combo for daily wear earrings for date nights. These collections are also suitable for valentine gifts, gifts for women, birthday gift for girls, anniversary gift for wife, gifts for girlfriend, Mother’s Day gifts. You name it in the collection of jewellery, Yellow Chimes has something for everyone.",4.1,Very elegant,https://m.media-amazon.com/images/I/41IX-oPF72L._SY300_SX300_.jpg
Earings,Zaveri Pearls Set Of 25 Gold Tone Smart Casual Wear Studs & Hoop Earrings For Women-ZPFK14053,348,"If You Happen To Love Fashion Earrings, Then You Are At Right Place, Explore The Latest Trends Of Earrings By Zaveri Pearls. Earrings Have A Way Of Pulling Together An Outfit. So, While You Have Many Options For Accessories, Earrings Take The Crown As The Best Accessories For Making Your Outfits Unique.",4.2,All earrings are very good.. simple and unique design. Best for a subtle look in office. Good for this price.,https://m.media-amazon.com/images/I/311fxd2m2ML._SY300_SX300_.jpg
Earings,YouBella Jewellery Earrings For Women Crystal Stud Earrings For Girls And Women,298,Meticulously designed to provide a perfect fit. Offers a premium quality material that ensure durability,4.1,Beautiful go for it,https://m.media-amazon.com/images/I/41KL64a-LCL._SY300_SX300_.jpg
Earings,YouBella Fashion Jewellery Gold Plated Ear rings Combo of Earrings for Girls and Women,359,"Stylish Party Wear Earrings - YouBella Fashion Jewellery presents these stylish Earrings which are suitable for all occasions office wear, wedding and party wear. The color complements all outfits & may be worn as a statement piece to any occasion. The designer artificial jewellery at YouBella is available in various designs and patterns like floral design, heart shape design, dancing peacock, crystal design and many more. The imitation designer jewellery that will go with your outfit and style up your fashion statement with variable designs and patterns to give you charming and elegant look is available at YouBella. YouBella has huge collection of designer imitation jewellery like american diamond jewellery collection, gold plated jewellery collection, temple jewellery collection, valentine collection, jewellery combos and many more.",3.8,Beautiful designs and quality,https://m.media-amazon.com/images/I/41QivJ1q1sL._SY300_SX300_.jpg
Earings,Zaveri Pearls Turquoise Blue Enamelled Contemporary Yellow Gold Semi Hoop Earring For Women-ZPFK14470,269,"We think we speak for everyone when we say, ‘Hoops are a vibe.’ The Hoops or semi hoops earrings are worth being your go-to piece of jewelry as they’re super versatile, in trend and can elevate any outfit instantly. Yes, hoop earrings are a classic, and as such, they are always in style. If you’re seeking a pair that’s more in tune with trends, you can experiment with hoops featuring enamel and textured designs.",4.1,Very sleek and elegnt. The finish is excellent.,https://m.media-amazon.com/images/I/31syvfxF6CL._SY300_SX300_.jpg
Earings,YouBella Fashion Jewellery Ear Rings Drop and Dangler Earings Crystal Earrings for Girls and Women,298,"Stylish Party Wear Earrings - YouBella Fashion Jewellery presents these stylish Earrings which are suitable for all occasions office wear, wedding and party wear. The color complements all outfits & may be worn as a statement piece to any occasion. The designer artificial jewellery at YouBella is available in various designs and patterns like floral design, heart shape design, dancing peacock, crystal design and many more. The imitation designer jewellery that will go with your outfit and style up your fashion statement with variable designs and patterns to give you charming and elegant look is available at YouBella. YouBella has huge collection of designer imitation jewellery like american diamond jewellery collection, gold plated jewellery collection, temple jewellery collection, valentine collection, jewellery combos and many more.",4.1,Value for money,https://m.media-amazon.com/images/I/51vy2z1KzXL._SY300_SX300_.jpg
Earings,YouBella Jewellery for women Gold Plated Floral Earings Earrings for Girls and Women,245,"Stylish Party Wear Earrings - YouBella Fashion Jewellery presents these stylish Earrings which are suitable for all occasions office wear, wedding and party wear. The color complements all outfits & may be worn as a statement piece to any occasion. The designer artificial jewellery at YouBella is available in various designs and patterns like floral design, heart shape design, dancing peacock, crystal design and many more. The imitation designer jewellery that will go with your outfit and style up your fashion statement with variable designs and patterns to give you charming and elegant look is available at YouBella. YouBella has huge collection of designer imitation jewellery like american diamond jewellery collection, gold plated jewellery collection, temple jewellery collection, valentine collection, jewellery combos and many more.",4.1,Lied the look n 2 colours on it,https://m.media-amazon.com/images/I/41kHZ+qK8XS._SY300_SX300_.jpg
Earings,Shining Diva Fashion Stylish Non Precious Base Metal Multicolour Pearl Earrings for Women - Combo 36 Pairs Set (12015er),300,"Latest design earrings 36 pairs combo set for women - shining diva fashion jewellery presents these stylish fancy party wear earrings for women and girls. a designer pair of stud earrings for women's and girls that will make you feel like a diva. the color complements all outfits & may be worn as a statement piece to any occasion. shining diva has huge collection of latest modern fashion and traditional jewellery accessories. shining diva is pioneer of imitation jewellery for women and designer crystal, traditional jhumka/ jhumki, ear studs, fancy tops, traditional earrings for women, fancy ear rings and american diamond hangings earrings for women and girls. shining diva fashion and traditional jewellery give true value for your money. buy shining diva trendy, artificial and stylish jewellery for women from amazon. these are also ideal for birthday gifts for girls, wife, valentine gifts for girlfriend, wedding gifts and anniversary gifts.",3.9,Cute lil earings...good quality... weightless...nice designs also...goodbuy😄,https://m.media-amazon.com/images/I/41CEh0YY0bL._SY300_SX300_.jpg
Earings,Shining Diva Fashion 12 Pairs Combo Latest Stylish Western Hoop and Crystal Pearl Stud Earrings for Women and Girls,298,"Latest Design Western Earrings. 12 pairs earrings Combo Set for Women. Shining Diva Fashion Jewellery presents these Stylish Fancy Party Wear Western Earrings for Women and Girls. A designer pair of new design stud earingset for Womens and Girls that will make you feel like a Diva. The color complements all outfits & may be worn as a statement piece to any occasion. Shining Diva has huge collection of latest modern Fashion and Traditional jewellery accessories. Shining Diva is pioneer of Imitation jewellery for women and designer crystal, traditional jhumka / jhumki, ear studs, fancy tops, traditional earrings for women , fancy ear rings and american diamond hangings Earrings for women and girls. Shining Diva Fashion and Traditional Jewellery give true value for your money. Buy Shining Diva trendy, artificial and stylish jewellery for women from Amazon. These are also ideal for birthday gifts for girls, Wife, valentine gifts for girlfriend, wedding gifts and anniversary gifts.",4.1,It was very nice. I liked it,https://m.media-amazon.com/images/I/41nFfYrfu6L._SY300_SX300_.jpg
Earings,Shining Diva Fashion Latest 18k Gold Plated AAA Crystal Diamonds Earrings For Women & Girls,299,"Latest Earrings for Women - Shining Diva Fashion Jewellery presents these AAA Crystal Studded Stylish Fancy Party Wear Earrings for Women and Girls. A designer pair of Earings for Women and Girls that will make you feel like a Diva. The color complements all outfits & may be worn as a statement piece to any occasion. Shining Diva has huge collection of latest modern Fashion and Traditional jewellery accessories. Shining Diva is pioneer of Imitation jewellery for women and designer crystal, traditional jhumka / jhumki , ear studs, fancy tops, traditional earrings for women , fancy ear rings and american diamond hangings Earrings for women and girls. Shining Diva Fashion and Traditional Jewellery give true value for your money. Buy Shining Diva trendy, artificial and stylish jewellery for women from Amazon in cheap low price offer. These are also ideal for birthday gifts for girls, Wife, wedding gifts and anniversary gifts.",4,"Light weight,anyone can wear for longtime.",https://m.media-amazon.com/images/I/51Z-dMVBAIL._SY300_SX300_.jpg
Earings,Shining Diva Fashion 2 Pairs Combo Celebrity Inspired Stylish Gold Silver Plated Teardrop Earrings Dupes for Women Girls Teenagers Trending Oversized Lightweight Statement Waterdrop Earrings,299,"Latest Stylish Design Western Earrings for Women. Shining Diva Fashion Jewellery presents these Stylish Western Fancy Party Wear Earrings for Women and Girls. A designer pair of latest new design stud Earings that will make you feel like a Diva. The color complements all outfits and may be worn as a statement piece to any occasion. Shining Diva has huge collection of latest modern Fashion and Traditional jewellery accessories. Shining Diva is pioneer of Imitation jewellery for women and designer crystal, traditional jhumka jhumki, ear studs, fancy tops, traditional earrings for women , fancy ear rings and american diamond hangings Earrings for women and girls. Shining Diva Fashion and Traditional Jewellery give true value for your money. Buy Shining Diva trendy, artificial and Stylish Western jewellery for women from Amazon in offer. These are also ideal for special birthday gifts for girls, Wife, valentine gifts for girlfriend, wedding gifts and anniversary gifts.",4.1,Its Nickel free and sensitive skin person can easily try.,https://m.media-amazon.com/images/I/31y7iY-uDPL._SY300_SX300_.jpg
