Category,Product Name,Price(?),Product Description,User Ratings (out of 5),Top Review,Product Image URL
Watches,OLEVS Watches for Men Chronograph Business Wrist Watches Analog Quartz Moon Phase Stainless Steel Waterproof Luminous Dress Watches,"2,805",OLEVS Watches For Men Chronograph Business Wrist Watches Analog Quartz Moon Phase Stainless Steel Waterproof Luminous Dress Watches,4.6,"I like this watch, I like the gold band. Easy to read time. Can't say that I can read the date to well. But overall I am very happy with this watch.",https://m.media-amazon.com/images/I/51pvCriTdOL._SY300_SX300_.jpg
Watches,Matrix Antique 2.0 Day & Date Softest Silicone Strap Analog Watch for Men & Boys,299,Matrix Watch,4.2,It's price is reasonable and is of good quality,https://m.media-amazon.com/images/I/41mzQ4Bg5hL._SY300_SX300_.jpg
Watches,TIMEWEAR Analog Day Date Functioning Stainless Steel Chain Watch for Men,319,Stay fashionable with this watch from TIMEWEAR available on Amazon. This Analogue watch has Round Dial. The Silver colored straps in the watch are Stylish,3.8,"It is really nice product. Looks sturdy, formal with elegant dial design.",https://m.media-amazon.com/images/I/415wDnu8sCL._SY300_SX300_.jpg
Watches,NIBOSI Men Watches Analog Quartz Stainless Steel Military Watches for Men Waterproof Business Classic Desiger Wrist Watch Date,"2,499","NIBOSI Stainless Steel Men's Watch Classic Business Design:Perfect for any outfit and any occasion, this unique business casual watch allows you to easily spice up your outfit and add style to your life. What's more, this NIBOSI watch comes with stylish gift packaging, it is the perfect gift for Gentlemen Husband Boys With Birthday Gift3ATM Daily Life Waterproof:Waterproof can withstand sweat, accidental rain or water splash, but not suitable for bathing, swimming, diving, etc.Dial Diameter: 40mmDial Thickness: 11mmBand Width: 19mmWatch Circumference: 220mm (adjustable)Watch Weight: 130gHigh Quality:High quality import quartz movement and battery; Premium stainless steel case and Strap; Classic dial design; Scratch resistant surface; Easy-to-Read time scaleWhat's in the package:1*NIBOSI Waterproof Business Watch For Men1*NIBOSI Wrist Watch Manual1*Luxury Gift Watch Box1*Adjustment Tool1*Microfiber Cleaning Cloth1*Warranty Card",4.7,"This gold color NIBOSI watch is quite attractive and has enough heft to it to indicate quality construction, but it is not so heavy as to be uncomfortable when wearing it. The watch looks far more expensive than its sub-$30.00 price would seem to indicate.The watch also comes in a nice gift box and includes the necessary tool to remove extra band links should the need arise---a nice touch!All in all, given its apparent quality and obvious attractiveness, I consider this NIBOSI watch to be a good value its current $24.90 price point less any available coupons and/or discounts.",https://m.media-amazon.com/images/I/416wu+VLPJL._SY300_SX300_.jpg
Watches,"Carlington Analog-Digital Sports Watch: Chronograph, Dual Time, Alarm, Stopwatch, Water-Resistant, Shock-Resistant, Back Light Display- The Perfect Watch for Men and Boys - CT9105","1,119","Introducing the Carlington Endurance Series Analog-Digital Watch Collection, where the fusion of style and functionality is seamless. Experience low-light visibility with the backlit display, track multiple timezones effortlessly, enhance your performance with the built-in stopwatch, and rest assured with shock and water resistance. Stay on schedule with the alarm function and keep track of dates, days, months, and years. Designed for both rugged outdoor exploration and daily urban ventures, the Carlington Endurance Series redefines durability without compromising elegance. Embrace the journey, seize every moment, and elevate your timekeeping with Carlington's Endurance Series Analog-Digital Watches.",3.8,"Amazing watch to wear. Best watch to buy, Its simply amazing, Superb product :)",https://m.media-amazon.com/images/I/51fzc9GthKL._SY300_SX300_.jpg
Watches,Fastrack Gold Dial Analog Watch for Women -6152WM01,"1,914","Fastrack, Fastrack Girls, Fastrack Women, Fashion, fashion watches, Flaunt, trendy, girls watches, Style up collection, Plated watches, Rose Gold Plating, Rose Gold Plated Metal Strap, Multilayered dial, Multifunction watch, Shaped case, Blue Plating, Brown plating, Everyday Fashion Watches",4.3,"Simple and classy, looks very good",https://m.media-amazon.com/images/I/41tgNQirhGL._SY300_SX300_.jpg
Watches,Lexiv NF9197-SGNGN Men's Military Digital Analog Quartz Waterproof Wrist Watch Leather Sport Multifunctional by Lexiv®,"2,437","Specification (approximate): Case diameter: 4.6cm Case thickness: 1.5cm Band Wideth: 2.2cm Band Length: 25cm Weight: 102g Band Adjustable: Yes 🌻 Description: 100% brand new and high quality. Durable Alloy case/back(Environmental protection vacuum plating) & High-quality Genuine Leather strap. Analog & Digital display. Japan original digital movement. Dual display watch: You can use it as two time zones or use one of them as the backup one.Make sure the time is under your control. LCD Display with Back-light: Advanced LCD display, energy saving Back-light supported, you can also read the time in dark night. When you need to read the time, press on the light button, it just lights up. Shows time digital numbers Digital And Analog Dual Display Sports Watch. Display time in numbers indicate the hour, minutes and seconds. Display the day & date 12h/24h, and week. Alarm clock function included. Stop watch function included: Calculate the time by 0.01 second minute. Precise quartz movement for accurate time keeping. Luminous hands. 3ATM water resistance (not for showering and swimming). 🌻 Package Included: 1 * Sport Watch 1 * Instruction 1 * Guarantee card",4.5,"I like the product but surprise to see that was supplied without box packing,came in plastic rape.price is slightly on higher side, otherwise product is good.",https://m.media-amazon.com/images/I/415fWzzqZDL._SY300_SX300_.jpg
Watches,Titan Neo Analog Grey Dial Women's Watch-2648WL01/NR2648WL01,"2,234","A collection of contemporary, range modern day work-wear watches for women in the age group of 25 to 35 years. These watches blend in the formal yet casual Workwear need among the new age millennial.",4.2,Looks so nice and beautiful. Worth for money,https://m.media-amazon.com/images/I/41asoxWq+xL._SY300_SX300_.jpg
Watches,Fossil Chronograph White Dial Men's Watch-CH2882,"5,946",Fossil Decker CH2882 Analogue Watch - For Men,4.3,"The Fossil Chronological Watch has exceeded my expectations! Its timeless design effortlessly combines style with functionality. The attention to detail, from the intricate dial to the genuine leather strap, showcases Fossil's commitment to quality. Accurate timekeeping and durable construction make it a reliable daily companion. Five stars for a watch that seamlessly blends classic elegance with modern reliability.",https://m.media-amazon.com/images/I/41Uh1iW3EiL._SY300_SX300_.jpg
Watches,Fossil Grant Sport Analog Blue Dial Men's Watch-FS5237,"8,121","Being chic doesn't always mean your accessories have to be flashy and loud. Maybe a subtle flair and unique qualities is exactly what you're looking for. If that's the case, then we're confident you will like this Fossil Grant watch. It's the perfect combination of smooth, fashionable, and exquisite. Don't get us wrong, you will no doubt turn heads with this beauty on your wrist, but in a manner that is more like a quiet beckoning than an obvious solicitation for attention. It features a sleek blue leather band, which is perfectly paired with a rose-gold 44mm stainless steel case. The combination of these two aspects work in splendid harmony as the case creates a glossy look and the band keeps it grounded with its simplicity. The best part about this watch is its dial, which flaunts a creative blue pattern. This is where that subtle flair comes in ladies! The pattern is just enough to make a fashionable statement, but without making it seem like you're trying. Another aspect that contributes to the glamour of this Fossil watch is its rose-gold detail, which creates a beautifully polished contrast with the design that's on the dial. This time-keeper is a winner, hands down, but it's not all good looks. This watch can handle up to 50 meters / 165 feet / 5 atm of water, so water damage is not in the books. In addition to its water resistance, its casing is made out of stainless steel, and its face is guarded by a heavy-duty mineral crystal. This watch can stand up to some serious roughhousing, without question. So if you're a lady who loves to stay in vogue but doesn't care to put on a show, this is your watch. Not only will you be killing it in the fashion world, but it'll last you a long time.",4.4,Awesome watch,https://m.media-amazon.com/images/I/51-DHFzI32L._SY300_SX300_.jpg
Watches,Armani Exchange Analog Black Dial Men's Watch-AX1343,"6,496",It can be used on a regular basis . It makes a great gift too .,4.2,Excellent watch it's looking very luxury,https://m.media-amazon.com/images/I/418z-h2dSzL._SY300_SX300_.jpg
Watches,Titan White Dial Analog Watch For Men -NR1805SL04,"4,439",Stay fashionable with Quartz watch from Titan available on Amazon. This Analogue watch has Round White dial with a dial diameter of 49.2 Millimeters . The Brown colored straps in the watch are made of Leather . This watch has 2 Years warranty.,4.2,Read more,https://m.media-amazon.com/images/I/417oh4jqyZL._SY300_SX300_.jpg
Watches,CITIZEN Analog Blue Dial Silver Band Men's Stainless Steel Watch-NJ0151-88M,"28,999.00","The blue round dial is protected by a sapphire glass. The stainless steel strap comes in a silver hue that further elevates the look of the timekeeper. Besides, it is completed with a fold over push button clasp with safety clasp to ensure a secure fit on the wrist.",4.7,"The media could not be loaded.
                



 Tiffany blue 💙  color is something else and with classic design and overall look is killing me with happiness 😊",https://m.media-amazon.com/images/I/41vfTgz-fcL._SX300_SY300_QL70_ML2_.jpg
Watches,Titan Edge Ceramic Analog White Dial Men's Watch NQ1696QC04,"26,095","This watch is beautifully designed. This is trendy, classy and stylish.",4.3,"I am a big fan of AP’s Ceramic perpetual calendar Royal oak, hence i was on a lookout for a similar watch. For 25k this watch is so beautiful and fits my wrist so well that easily can be considered a conversation starter. The only drawback with this watch is that you get no luminosity hence the night time visibility can be an issue.",https://m.media-amazon.com/images/I/31Y6FmoknXL._SY300_SX300_.jpg
Watches,Titan Regalia Opulent Analog Black Dial Men's Watch-90127YM02/NR90127YM02,"5,594",Bold Dressing from Titan,5,Nice Watch,https://m.media-amazon.com/images/I/41FS5I02j0L._SY300_SX300_.jpg
Watches,Victorinox Maverick Analogue Men's Stainless Steel Watch(Green Dial Mens Standard Colored Strap)-241693,"52,199.00","Gold PVD stainless steel case with a two-tone (silver and gold PVD) stainless steel bracelet. Uni-directional rotating gold PVD bezel with green PVD top ring. Green dial with luminous gold-tone hands and index hour markers. Arabic numerals mark the 3 and 9 o'clock position. Minute markers. Tachymeter around the outer rim. Dial Type: Analog. Luminescent hands and markers. Date display at the 6 o'clock position. Chronograph - three sub-dials displaying: 60 second, 30 minute and 12 hour. Quartz movement. Scratch resistant sapphire crystal. Screw down crown. Solid case back. Case diameter: 43 mm. Case thickness: 12.2 mm. Round case shape. Band width: 22 mm. Fold over clasp with a push button release. Water resistant at 100 meters / 330 feet. Functions: chronograph, tachymeter, date, hour, minute, second. Casual watch style. Victorinox Swiss Army Maverick Chronograph Green Dial Two-tone Men's Watch 241693.",4.6,The look is adorable,https://m.media-amazon.com/images/I/51KmCFctiWL._SY300_SX300_.jpg
Watches,Diesel Analog Stainless Steel Black Dial and Band (Big dial) Men's Watch-DZ7395,"33,995","This is one watch which you will make sure you look at it more than once. Made for office warriors, Fossil's eye-catching construction and chronograph functionality play with a modern aesthetic. Sleek and streamlined with a thick two-tone bracelet, it's made for the man who likes his style somewhere between formal and sophisticated.",4,Best product you can feel it it's little big but it's looks good.,https://m.media-amazon.com/images/I/41keloZ5X4L._SY300_SX300_.jpg
Watches,Men's Citizen Eco-Drive Chronograph Gold-Tone Stainless Steel Bracelet Watch CB5912-50E,"1,25,098","Monitor your valuable time in style with this handsome radio-controlled watch from Citizen. Featuring a 43mm gold-tone stainless steel case with a tachymeter, a gold-tone stainless steel bracelet, quartz Eco-Drive WR 200 movement, and water resistance up to 200 meters, this efficient device is as resilient as it is dashing. The black chronograph dial exhibits a date window at 4 o'clock and luminous accents for easy readability at night or in dim lighting.43mm gold-tone stainless steel case with tachymeterGold-tone stainless steel braceletBlack chronograph dial with luminous accents and date window at 4 o'clockRadio controlledWater resistant up to 200 metersQuartz Eco-Drive WR 200 movementCitizen style #: CB5912-50E",4.5,"The watch is stunning.  It is my seventh citizen Eco-Drive watch and so far it is my best.  The watch came to me virtually set up.  I had to set the radio control location to Denver Colorado USA to match my location in Calgary Alberta Canada and turn the daylight saving indicator to off.  Then I had to remove two of the bracelet tangs so that the watch would fit my wrist.  Then I removed all the stick on plastic protecting the watch and strap. I downloaded the operation manual from Amazon support and checked the settings for the perpetual calendar.  Everything was properly preset, but it was all very easy to achieve. The watch band now fits my large wrist and does not pinch.  It is perfect now.  The set up was child's play, but then this is my seventh Citizen watch and setting it up was a simple repeat of my past Citizen watch's.  They are all fairly similar in set up..",https://m.media-amazon.com/images/I/51hz+VpPKQL._SY300_SX300_.jpg
Watches,Luminox Men's Atacama Field Automatic 1907 Watch,"1,34,972","Dial Color: White , Dial Style: Round , Case Material: Steel , Strap Material: Textile , Movement: Automatic , Display Type: Analog , Glass Type: Sapphire Crystal , Water Resistance: 200 , Case Size: 44 mm , Clasp Type: Buckle",4.6,"The appearance is drop-dead gorgeous.  Although a heavy watch, it feels great on my medium size wrist.  The time is perfect!  The only downside is it does not come with a manual and setting the watch is a convoluted method.  I spent an hour online and finally called Luminox Customer Service.  They were TERRIFIC❗ I'm all squared away now.  The storage-holding and shipping container is nearly bomb-proof.  One look, one feel, one wrist placement and you'll know this baby is worth every hard-earned cent.",https://m.media-amazon.com/images/I/41By0MCqP9L._SY300_SX300_.jpg
Watches,NIBOSI Men's Watches Analog Business Chronograph Casual Watches Military Waterproof Stainless Steel Wrist Watches for Boy,"3,099","NIBOSI Quartz Dress Men's Watch Classic Elegant Design:Perfect for any outfit and any occasion, this unique business casual watch allows you to easily spice up your outfit and add style to your life. What's more, this NIBOSI watch comes with stylish gift packaging, it is the perfect gift for Gentlemen Husband Boys With Birthday Gift3ATM Daily Life Waterproof:Waterproof, can withstand sweat, accidental rain or water splash, but not suitable for bathing, swimming, diving, etc.Dial Diameter: 44mmDial Thickness: 12mmBand Width: 20mmWatch Circumference: 220mm (adjustable)Watch Weight: 140gHigh Quality:Imported japanese quartz movement and battery; Glow in the dark; Premium stainless steel strap and case cover; Precision chronograph with minute, second and hour; Stylish dial design; Scratch resistant surface; Easy-to-Read time scaleWhat's in the package:1*NIBOSI Chronograph Military Men's Watch1*NIBOSI Watches Manual1*Luxury Gift Watch Box1*Adjustment tool1*High Quality Microfiber Cleaning Cloth",3.9,Stunning look and easy to wear.,https://m.media-amazon.com/images/I/41ELc+tU5hL._SY300_SX300_.jpg
Watches,NIBOSI Watch for Men Fashion Business Men Watches Ultra-Thin Waterproof Chronograph Quartz Watches with Stainless Steel Band,"2,999","Nibosi brings you the latest trends in watches. Stylish, Bold, Minimalist, fashionable are some of the words that are synonymous with the name Nibosi. Going out on a date Or a business meeting? Get ready to impress!",3.8,"This watch is a very nice and light watch, it is one of the beat watches under 3000 INR and is a 5/5 for me. There is a feature they have not shown in the image which is luminous function at night it's really helpful when you are travelling and if you just want to enjoy your time while not looking at your phone every now and then for time. One important thing to note id that if you get the chronograph settings at 3' O clock or 7'O clock or the chronograph os basically not at 12'O clock position then just set the dial button to '2' or simply pull it out to the position where you can change the time and then press the upper button/ Button 'A' for changing the 1/10 Sec hand or long press the Button 'B' to change your Second hand( If you change the second hand your min hand will also change for the chronograph and to avoid that long press the button until the minute hand comes till 58 or 59 minutes and then simply just continously press the button 'B' instead of long pressing it so that you can Artange the minute hand and second hand at 12'O clock) then simply just set the dial to current time and your watch will function normally. When you now press the start/stop button and reset the chronograph it will definitely come back to 00( For sec and 1/10 Second hand) and 60(For min hand). Also I'd like to mention that it's strap feels premium so no worrying about the strap( It's easy to remove also)",https://m.media-amazon.com/images/I/41qVRkQrUKL._SY300_SX300_.jpg
Watches,NIBOSI Chronograph Men's Watch,"2,890",Stay fashionable with Quartz watch from NIBOSI available on Amazon. This Chronograph watch has Round dial with a dial diameter of 1.69 inches The straps in the watch are made of Stainless Steel . This watch has 24 Months Warranty.,3.9,"The media could not be loaded.
                

",https://m.media-amazon.com/images/I/41nABmyOVjL._SY300_SX300_.jpg
Watches,LONGBO Analog Business Casual Stainless Steel Decorative Subdials Watch for Men,849,"Hight quality stainless steel case make the watch look luxury, Made of high qulity stainless steel case, this watch case is sturdy and not easy to fade, making you the shining star in all occasions.The luxurious fashion design exterior suits every business man.Wearing it could attend all business occasions. Stainless steel watch band and double-locking-fold-over-clasp. Comfortable to wear and easy to operate.  Disclaimer: Sub Dials are for decorative purpose only and do not work Features  Japanese movement can provide precise and accurate time keeping.   Minerals hardened mirror provides high transparency and durability which enables you to see time clearly with scratch-resistance ability.   Stainless Steel Strap, Elegant and comfortable to wear.   30m waterproof, enables you to wear it while washing hands and under rains Specification Item Type: Analog Wristwatches Gender: Men Style: Business Casual  Case Shape: Round Dial Window Material Type: Minerals Hardened Glass  Case Material: Stainless Steel  Clasp Type: Push Button Folding Clasp Strap Material Type: Stainless Steel Dial Diameter: 47mm Case Thickness: 13mm Band Length: 255mm Band Width: 23mm",4,Excellent one...,https://m.media-amazon.com/images/I/51oXGpfjPvL._SY300_SX300_.jpg
Watches,NIBOSI Men Watches Analog Quartz Stainless Steel Military Watches for Men Waterproof Business Classic Desiger Wrist Watch Date,"2,499","NIBOSI Stainless Steel Men's Watch Classic Business Design:Perfect for any outfit and any occasion, this unique business casual watch allows you to easily spice up your outfit and add style to your life. What's more, this NIBOSI watch comes with stylish gift packaging, it is the perfect gift for Gentlemen Husband Boys With Birthday Gift3ATM Daily Life Waterproof:Waterproof can withstand sweat, accidental rain or water splash, but not suitable for bathing, swimming, diving, etc.Dial Diameter: 40mmDial Thickness: 11mmBand Width: 19mmWatch Circumference: 220mm (adjustable)Watch Weight: 130gHigh Quality:High quality import quartz movement and battery; Premium stainless steel case and Strap; Classic dial design; Scratch resistant surface; Easy-to-Read time scaleWhat's in the package:1*NIBOSI Waterproof Business Watch For Men1*NIBOSI Wrist Watch Manual1*Luxury Gift Watch Box1*Adjustment Tool1*Microfiber Cleaning Cloth1*Warranty Card",4.7,"This gold color NIBOSI watch is quite attractive and has enough heft to it to indicate quality construction, but it is not so heavy as to be uncomfortable when wearing it. The watch looks far more expensive than its sub-$30.00 price would seem to indicate.The watch also comes in a nice gift box and includes the necessary tool to remove extra band links should the need arise---a nice touch!All in all, given its apparent quality and obvious attractiveness, I consider this NIBOSI watch to be a good value its current $24.90 price point less any available coupons and/or discounts.",https://m.media-amazon.com/images/I/41hC5IZ-F1L._SY300_SX300_.jpg
Watches,Shocknshop Digital Sports Latest Multifunctional Electronic LED Black Dial Wrist Watch for Men Boys -WCH84,375,"Digital Dial Men Watch with LED DisplayDigital timepieces have not only upgraded their high-tech features but have also caught up to the design challenge. With a digital watch, you get the best of both worlds - smart, sophisticated shape, and state-of-the-art technology. The modern digital watch for men is fast shaping up to be the accessory of the future, rather than a novelty of a bygone era. Dressed up for a business lunch or pared down for a hike in the mountains, the digital watch for men wears as well as it performs.In addition to the obvious fashion benefits, there are several other reasons to choose silicone to showcase your watch bling. Silicone is a durable material that helps fashion meet versatility. This men's watch has a simple design with a dial that's easy to read and a medium to large size, so it does not catch on cuffs or equipment. The digital watch for men is a great accessory that can be worn in many settings, making it one of the best watches for men.With a handsome LED face, clear bold colors, and a smooth sports band, the Shocknshop Watch is perfect for the man of action who loves watches for men.",4.5,Read more,https://m.media-amazon.com/images/I/41R1ToQBw8L._SY300_SX300_.jpg
Dresses,DHRUVI TRENDZ Women Rayon Co-Ord Set,499,"Explore a diverse collection of women's co-Ord sets catering to every style and occasion. From ethnic and western wear to winter Woolens and party-ready ensembles, find the perfect outfit for any event. Elevate your look with formal blazer sets or opt for chic black designs; express your unique style with tie-dye or embrace comfort in cotton selections. Whether it's shorts for a casual day out or traditional kaftans for a cultural flair, discover versatile options suitable for the beach, office, or any setting. Browse through our range to find the ideal co-Ord set that effortlessly combines elegance, comfort, and individuality.",3.4,This product is good in quality. Print is nice. Comfortable and stylish. Length of pant is good. Super in quality. Kurti material is soft. This is same product as shown in picture.,https://m.media-amazon.com/images/I/4157nI49rbL._SY445_SX342_.jpg
Dresses,Lymio Dresses for Women || Western Dresses for Women || Dress for Women || Dresses (D-701-702),499,Dresses for Women || Western Dresses for Women || Dress for Women || Dresses,4.8,"its a western style dress,good quality fabric,and fitting is alao good overall good dress i like it...",https://m.media-amazon.com/images/I/41sdXbMPQBL._SY445_SX342_.jpg
Dresses,Leriya Fashion Dress for Women | One Piece Dress for Women | Beach Dress for Women,379,"Discover a versatile and chic collection of women's dresses designed for every occasion. From the everyday sophistication of midi dresses to the laid-back vibes of beach dresses, and the timeless elegance of Anarkali dresses for special events, our curated range caters to diverse style preferences. Embrace the joy and positivity of Haldi ceremonies with our specially designed dresses, and simplify your wardrobe with our elegant one-piece options. For glamorous evenings, our party wear dresses ensure you stand out with confidence. Explore our collection, redefine your look for every moment, and make a statement with fashion that seamlessly blends comfort, style, and elegance for the modern woman.",4.4,"Good quality, lovely pattern and color combination dress. Good for outing as it is comfortable. It's same as shown in picture .You can go for it friends.",https://m.media-amazon.com/images/I/41ZHOb-6GrL._SY445_SX342_.jpg
